keyword,top_domains
zakelijke lening,"abnamro.nl, new10.com, rabobank.nl, qredits.nl, capitalbox.nl"
kredietlijn,"mozzeno.com, lookandfin.com, cofidis.be, eijgenfinance.nl, briqwise.com"
beobank kredietlijn verhogen,"beobank.be, cdn.beobank.be, spaargids.be"
abn amro doorlopend krediet zakelijk,"abnamro.nl, new10.com, bnnvara.nl"
abn amro zakelijk doorlopend krediet,"abnamro.nl, new10.com, bnnvara.nl"
abn zakelijk doorlopend krediet,"abnamro.nl, new10.com, bnnvara.nl, zakelijkelening.nl, zakelijkelening.com"
bereidstellingsprovisie rekening courant krediet,"ing.nl, abnamro.nl, mnadviseurs.nl, cnoop.nl, rabobank.nl"
bkr inlog zakelijk,"bkr.nl, mijnkredietregistratie.nl, zakelijk.bkr.nl, ing.nl, abnamro.nl"
bkr registratie telefoon zakelijk,"vodafone.nl, kpn.com, boom-in-business.nl, bloeise.nl, mobiel.nl"
bkr registratie zakelijk,"bkr.nl, mijnkredietregistratie.nl, regiobank.nl, floryn.com, rabobank.nl"
bkr registratie zakelijk krediet,"bkr.nl, mijnkredietregistratie.nl, floryn.com, regiobank.nl, capitalbox.nl"
bkr zakelijk,"bkr.nl, mijnkredietregistratie.nl, zakelijk.bkr.nl, regiobank.nl, autoriteitpersoonsgegevens.nl"
bkr zakelijk bellen,"bkr.nl, mijnkredietregistratie.nl, vodafone.nl, kpn.com, rabobank.nl"
bkr zakelijk contact,"bkr.nl, mijnkredietregistratie.nl, rabobank.nl, coderingvrij.nl, autoriteitpersoonsgegevens.nl"
bkr zakelijk inloggen,"bkr.nl, mijnkredietregistratie.nl, zakelijk.bkr.nl, floryn.com, abnamro.nl"
bkr zakelijk inzien,"bkr.nl, mijnkredietregistratie.nl, zakelijk.bkr.nl, autoriteitpersoonsgegevens.nl, regiobank.nl"
bkr zakelijk krediet,"bkr.nl, mijnkredietregistratie.nl, regiobank.nl, floryn.com, capitalbox.nl"
bkr zakelijk opvragen,"bkr.nl, mijnkredietregistratie.nl, zakelijk.bkr.nl, regiobank.nl, autoriteitpersoonsgegevens.nl"
bkr zakelijk portaal,"bkr.nl, mijnkredietregistratie.nl, boxtel.bestuurlijkeinformatie.nl, zakelijk.bkr.nl, spielwork.com"
bkr zakelijk portaal inloggen,"bkr.nl, mijnkredietregistratie.nl, zakelijk.bkr.nl, boxtel.bestuurlijkeinformatie.nl"
bkr zakelijk telefoonnummer,"bkr.nl, mijnkredietregistratie.nl, regiobank.nl, autoriteitpersoonsgegevens.nl, coderingvrij.nl"
bkr zakelijke lease,"financialleasezzp.nl, anwb.nl, shortleaseland.nl, regeljelease.nl, leasefinancier.nl"
bkr zakelijke lening,"bkr.nl, mijnkredietregistratie.nl, zakelijkelening.nl, floryn.com, bieb.knab.nl"
bmw x1,"bmw.nl, van-poelgeest.nl, autoscout24.nl, demaasschebmw.nl, gaspedaal.nl"
bmw x2,"bmw.nl, autoscout24.nl, van-poelgeest.nl, ekris.nl, gaspedaal.nl"
bmw x3,"bmw.nl, autoscout24.nl, dusseldorpbmw.nl, autoblog.nl, uw-bmw-occasions.nl"
bmw x3 hybride,"bmw.nl, van-poelgeest.nl, gaspedaal.nl, vakgaragejelsma.nl, uw-bmw-occasions.nl"
bmw x4,"bmw.nl, van-poelgeest.nl, dusseldorpbmw.nl, autoscout24.nl, uw-bmw-occasions.nl"
bmw x5,"bmw.nl, autoscout24.nl, van-poelgeest.nl, gaspedaal.nl, nl.wikipedia.org"
bmw x5 m,"bmw.nl, van-poelgeest.nl, autoscout24.nl, dusseldorpbmw.nl, oostlandbmw.nl"
bmw x6,"bmw.nl, autoscout24.nl, uw-bmw-occasions.nl, gaspedaal.nl, van-poelgeest.nl"
bmw x7,"bmw.nl, autoscout24.nl, van-poelgeest.nl, ekris.nl, dusseldorpbmw.nl"
bmw xm,"bmw.nl, ekris.nl, van-poelgeest.nl, autoscout24.nl, dusseldorpbmw.nl"
